{
  "$ref": "#/definitions/cms.articles",
  "definitions": {
    "cms.articles": {
      "type": "object",
      "properties": {
        "items": {
          "type": "array",
          "items": {
            "type": "object",
            "properties": {
              "slug": {
                "type": "string"
              },
              "title": {
                "type": "string"
              },
              "excerpt": {
                "type": "string"
              },
              "category": {
                "type": "string"
              },
              "source": {
                "type": "string"
              },
              "publishedAt": {
                "anyOf": [
                  {
                    "type": "string",
                    "format": "date-time"
                  },
                  {
                    "type": "string",
                    "format": "date-time"
                  }
                ]
              },
              "readingMinutes": {
                "type": "integer",
                "exclusiveMinimum": 0
              },
              "bodyMarkdown": {
                "type": "string"
              }
            },
            "required": [
              "slug",
              "title",
              "excerpt",
              "category",
              "source",
              "publishedAt",
              "readingMinutes",
              "bodyMarkdown"
            ],
            "additionalProperties": false
          }
        },
        "total": {
          "type": "integer",
          "minimum": 0
        },
        "page": {
          "type": "integer",
          "exclusiveMinimum": 0
        },
        "pageSize": {
          "type": "integer",
          "exclusiveMinimum": 0
        }
      },
      "required": [
        "items",
        "total",
        "page",
        "pageSize"
      ],
      "additionalProperties": false
    }
  },
  "$schema": "http://json-schema.org/draft-07/schema#"
}