{
  "items": [
    {
      "slug": "fed-signals-rate-path-september",
      "title": "ФРС даёт сигнал о траектории ставки: рынки закладывают снижение в сентябре",
      "excerpt": "Протокол июльского заседания показал растущее число сторонников смягчения. Доллар ослаб к корзине основных валют, доходности казначейских облигаций снизились.",
      "category": "economy",
      "source": "Аналитический отдел Apex Capital",
      "publishedAt": "2026-07-23T08:30:00Z",
      "readingMinutes": 4,
      "bodyMarkdown": "Опубликованный накануне протокол заседания Федеральной резервной системы показал, что большинство членов комитета считает целесообразным начать цикл смягчения уже на сентябрьском заседании, если инфляционная динамика сохранится. Фьючерсы на ставку закладывают вероятность снижения на 25 б.п. в 78%.\n\nИндекс доллара DXY отреагировал снижением на 0.4%, пара EURUSD поднялась к отметке 1.0850. Доходность 10-летних казначейских облигаций опустилась ниже 4.1% — минимума за последние шесть недель.\n\nДля трейдеров ключевым событием недели остаётся публикация базового индекса PCE в пятницу: показатель выше прогноза способен быстро развернуть ожидания рынка и вернуть спрос на доллар."
    },
    {
      "slug": "gold-tests-record-highs",
      "title": "Золото тестирует исторические максимумы на фоне слабеющего доллара",
      "excerpt": "XAUUSD прибавляет третью сессию подряд. Аналитики называют цели в диапазоне $2 450–2 480 при закреплении выше $2 420.",
      "category": "forex",
      "source": "Аналитический отдел Apex Capital",
      "publishedAt": "2026-07-23T06:10:00Z",
      "readingMinutes": 3,
      "bodyMarkdown": "Котировки золота обновили недельный максимум и торгуются в районе $2 417 за унцию. Поддержку металлу оказывают ожидания снижения ставки ФРС и продолжающиеся покупки со стороны центральных банков Азии.\n\nТехнически цена удерживается выше 20-дневной скользящей средней, а индекс относительной силы ещё не достиг зоны перекупленности. Ближайшее сопротивление — $2 431, далее — исторический максимум.\n\nРиском для быков остаётся сильная макростатистика США: неожиданно высокие данные по занятости или инфляции способны спровоцировать коррекцию к поддержке $2 380."
    },
    {
      "slug": "nvidia-earnings-preview",
      "title": "Отчёт NVIDIA: чего ждать рынку от главного бенефициара ИИ-бума",
      "excerpt": "Консенсус ожидает выручку $37.5 млрд. Опционный рынок закладывает движение акций на ±9% после публикации.",
      "category": "stocks",
      "source": "Аналитический отдел Apex Capital",
      "publishedAt": "2026-07-22T15:45:00Z",
      "readingMinutes": 5,
      "bodyMarkdown": "На следующей неделе NVIDIA представит квартальную отчётность, которая традиционно задаёт тон всему технологическому сектору. Консенсус-прогноз аналитиков предполагает выручку $37.5 млрд (+62% год к году) и скорректированную прибыль $0.95 на акцию.\n\nКлючевой вопрос — динамика сегмента дата-центров и комментарии менеджмента о спросе на новое поколение ускорителей. Любой намёк на замедление заказов гиперскейлеров рынок воспримет болезненно: бумага торгуется с мультипликатором P/E выше 45.\n\nОпционный рынок закладывает движение на ±9% в день после отчёта. Для держателей CFD на NVDA это означает повышенные требования к управлению риском: рекомендуем заранее определить уровни выхода и не превышать стандартный размер позиции."
    },
    {
      "slug": "bitcoin-etf-inflows-resume",
      "title": "Приток средств в биткоин-ETF возобновился: $850 млн за неделю",
      "excerpt": "После трёх недель оттока спотовые ETF снова привлекают капитал. BTCUSD консолидируется у $67 500, ключевое сопротивление — $69 000.",
      "category": "crypto",
      "source": "Аналитический отдел Apex Capital",
      "publishedAt": "2026-07-22T11:20:00Z",
      "readingMinutes": 3,
      "bodyMarkdown": "Согласно данным провайдеров, чистый приток в американские спотовые биткоин-ETF за прошедшую неделю составил $850 млн — лучший результат за полтора месяца. Основной объём пришёлся на фонды крупнейших управляющих компаний.\n\nКурс биткоина консолидируется в диапазоне $66 000–68 000. Закрепление выше $69 000 откроет дорогу к повторному тесту исторического максимума, тогда как потеря поддержки $64 500 усилит давление продавцов.\n\nВолатильность эфириума остаётся повышенной в преддверии решения регулятора по заявкам на стейкинг в составе ETF — событие способно стать катализатором для всего альткоин-сегмента."
    },
    {
      "slug": "ecb-holds-rates-lagarde-comments",
      "title": "ЕЦБ сохранил ставки: Лагард указала на сентябрь как «открытое окно»",
      "excerpt": "Регулятор ожидаемо взял паузу. Евро укрепился после пресс-конференции: рынок услышал меньше «голубиных» сигналов, чем рассчитывал.",
      "category": "economy",
      "source": "Аналитический отдел Apex Capital",
      "publishedAt": "2026-07-21T14:00:00Z",
      "readingMinutes": 4,
      "bodyMarkdown": "Европейский центральный банк оставил ключевые ставки без изменений, взяв паузу после июньского снижения. Решение совпало с ожиданиями рынка, поэтому основное внимание было приковано к риторике главы регулятора.\n\nКристин Лагард отметила, что сентябрьское заседание остаётся «полностью открытым», а дальнейшие решения будут зависеть от поступающих данных. Отсутствие явных обещаний смягчения рынок расценил как умеренно ястребиный сигнал.\n\nПара EURUSD прибавила 0.3% на пресс-конференции. Спред между доходностями немецких и американских десятилетних бумаг сузился до минимума с весны, поддерживая единую валюту."
    },
    {
      "slug": "oil-inventories-draw-opec-outlook",
      "title": "Запасы нефти в США сокращаются пятую неделю подряд",
      "excerpt": "Минэнерго отчиталось о снижении запасов на 3.7 млн баррелей. Brent удерживается выше $85 в ожидании отчёта ОПЕК.",
      "category": "economy",
      "source": "Аналитический отдел Apex Capital",
      "publishedAt": "2026-07-21T09:05:00Z",
      "readingMinutes": 3,
      "bodyMarkdown": "Коммерческие запасы сырой нефти в США за неделю снизились на 3.7 млн баррелей при прогнозе −1.9 млн. Серия из пяти недель сокращения — самая длинная с прошлого лета и указывает на устойчивый спрос в разгар автомобильного сезона.\n\nКотировки Brent удерживаются выше $85 за баррель, WTI торгуется у $81.6. Трейдеры ожидают ежемесячный отчёт ОПЕК: подтверждение прогноза роста мирового спроса поддержит текущий восходящий импульс.\n\nСдерживающим фактором остаётся динамика добычи вне картеля: рекордные объёмы из США и Бразилии ограничивают потенциал ралли выше $90 без дополнительных шоков предложения."
    }
  ],
  "total": 6,
  "page": 1,
  "pageSize": 20
}